{
  "ecp_object": "evaluation",
  "evaluation_id": "ECP-EVAL-DEMO-0001",
  "protocol_version": "0.1.0",
  "schema_version": "0.1.0",
  "evaluation_status": "defined",
  "system": {
    "system_id": "ECP-SYSTEM-DEMO-AGENT",
    "system_version": "1.1.0"
  },
  "case_set": {
    "case_set_id": "ECP-CASESET-DEMO-0001",
    "case_set_version": "0.1.0",
    "case_ids": ["ECP-CASE-DEV-0001"]
  },
  "created_at": "2026-09-09T00:00:00Z",
  "description": "FORMAT EXAMPLE - a defined (paper-only) evaluation: nothing is registered, executed or collected."
}
